{
  "$schema": "../schemas/manuscript_writing_workflow.v1.schema.json",
  "schema_version": "manuscript_writing_workflow.v1",
  "updated_at": "2026-05-27",
  "policy": "Manuscript writing and polishing use a contract-first workflow. Nature-style writing craft is adapted for English high-impact journal work and technical computational social-science manuscripts, and target-journal corpus signals can guide pre-submission style adaptation after readability review. Chinese journals, CSSCI writing, traditional quantitative work, and qualitative research keep the local social-science standard as the primary rule; no style layer can override facts, evidence, citations, results, or author decisions.",
  "source_review_refs": [
    {
      "upstream": "Yuan1z0825/nature-skills",
      "repo_url": "https://github.com/Yuan1z0825/nature-skills",
      "commit": "d6fe5146afcb28f37f3ef2fba0fe56e696ad8153",
      "adopted_as": [
        "article architecture before sentence polishing",
        "section-specific writing contracts for title, abstract, introduction, methods, results, discussion, and conclusion",
        "logic-first polishing diagnosis",
        "claim-evidence-boundary calibration",
        "reader-flow and paragraph-control checks",
        "Chinese-to-English rebuild before English polish"
      ],
      "not_adopted": [
        "bulk installing the nature-* skill bundle",
        "Nature/CNS house style as the default social-science journal target",
        "biomedical, materials, image-experiment, or wet-lab standards as default gates",
        "PubMed or MeSH as default discovery priority",
        "English-language style rules overriding Chinese journal conventions"
      ]
    },
    {
      "upstream": "Jinze-Lee/codex-skills-workbench",
      "repo_url": "https://github.com/Jinze-Lee/codex-skills-workbench",
      "commit": "7aa34a5039d52a062152db56eabcd3b72893c851",
      "adopted_as": [
        "long-form writing intake with project facts and asset inventory",
        "chapter plan before chapter prose",
        "decisions log for user confirmations and assumptions",
        "figure, table, formula, code, data, and reference manifests",
        "placeholder protocol for figures, tables, equations, symbols, and references",
        "template-preserving DOCX workflow as explicit opt-in pattern"
      ],
      "not_adopted": [
        "auto-triggering a thesis studio for ordinary paper writing",
        "bundled Word templates as local defaults",
        "Word XML script runtime as the default docx export path",
        "manual reference numbering that bypasses citation verification",
        "example data, example figures, or simulated results without explicit user permission"
      ]
    },
    {
      "upstream": "Leey21/awesome-ai-research-writing",
      "repo_url": "https://github.com/Leey21/awesome-ai-research-writing",
      "commit": "c07628b453309a1fb131ee105b2f01190162bc6c",
      "adopted_as": [
        "format-sensitive Chinese-English rewriting for LaTeX versus Word",
        "back-translation or logic-flow check after bilingual rewriting",
        "micro shorten and expand operations with explicit delta logs",
        "minimal-change Chinese and English polishing thresholds",
        "AI-style surface cleanup without changing claims",
        "logic redline check that reports only blocking issues",
        "data-bound experiment or result analysis paragraphs",
        "plain academic figure and table title generation",
        "reviewer-perspective final audit with fatal-versus-fixable distinction",
        "conference or journal venue migration checklist as a submission-package adapter"
      ],
      "not_adopted": [
        "copying the prompt bundle verbatim as local runtime instructions",
        "OpenSkills installation as a local stack management path",
        "current model ranking or provider preference as environment policy",
        "CS or LLM conference assumptions as default social-science manuscript structure",
        "arXiv translator runtime as a default local paper-writing tool",
        "letting a prompt template bypass citation verification, figure gates, or package freeze checks"
      ]
    },
    {
      "upstream": "brycewang-stanford/Awesome-Agent-Skills-for-Empirical-Research",
      "repo_url": "https://github.com/brycewang-stanford/Awesome-Agent-Skills-for-Empirical-Research",
      "commit": "e03ff8cf62f1ce8739c4181cead149da5dd84b11",
      "adopted_as": [
        "claim-preserving academic humanization as a surface audit",
        "Chinese academic de-template scan for mechanical connectives, inflated novelty, and low-density phrases",
        "English academic humanizer checks for vague attribution, excessive hedging, causal overclaiming, and generic conclusions",
        "second-pass audit after polishing",
        "detector-evasion boundary: improve authorial academic prose without promising to bypass detection",
        "detect-first then rewrite-second academic humanization workflow",
        "Chinese five-step de-template loop: locate, classify, rewrite, self-check, second-pass review",
        "English severity audit for vague attribution, inflated novelty, causal overclaiming, formulaic transitions, generic conclusions, and rhythm uniformity",
        "locked-items ledger before any surface rewrite"
      ],
      "not_adopted": [
        "bulk installing external humanizer, deslop, stop-slop, avoid-ai-writing, or Chinese de-AIGC skills as competing runtime routes",
        "treating AIGC score reduction as more important than academic integrity",
        "changing claims, evidence, citations, variables, model results, or uncertainty for surface style",
        "copying detector-specific tactics as local policy",
        "using an external humanizer skill to bypass local writing quality, citation, or peer-review gates",
        "optimizing manuscripts for a detector score instead of writing quality and evidence integrity",
        "adding fake human imperfection, typos, colloquial looseness, or unsupported stylistic noise"
      ]
    },
    {
      "upstream": "hardikpandya/stop-slop",
      "repo_url": "https://github.com/hardikpandya/stop-slop",
      "commit": "8da1f030185bdfe8471220585162991eaeb970e9",
      "adopted_as": [
        "language-density scan for throat-clearing, filler, vague declaratives, and performative emphasis",
        "structural scan for binary contrast, negative listing, rhetorical setup, false agency, and rhythm monotony",
        "directness, rhythm, trust, authenticity, and density rubric as a second-pass surface review",
        "pattern-only deslop adapter inside local manuscript and humanization workflows"
      ],
      "not_adopted": [
        "installing stop-slop as a competing runtime skill",
        "blanket removal of all adverbs, passive constructions, hedges, or field-standard wording",
        "using conversational prose as the default for formal academic writing",
        "detector-evasion, fake human errors, or style changes that alter claims, evidence, citations, or uncertainty"
      ]
    },
    {
      "upstream": "ganzhi-black/humanities-thesis-skill",
      "repo_url": "https://github.com/ganzhi-black/humanities-thesis-skill",
      "commit": "9f9c97162e250df8d6c214b828bb973828a2a780",
      "adopted_as": [
        "humanities thesis intake before drafting",
        "research object, problem, thesis direction, theory, type, and length confirmation",
        "theory-as-tool and material-as-destination writing rule",
        "close-reading and material-first chapter opening discipline",
        "chapter progression and transition paragraph checks",
        "quote-followed-by-analysis requirement",
        "humanities literature review grouped by argument function",
        "terminology consistency and bilingual glossary check",
        "footnote function and format checks"
      ],
      "not_adopted": [
        "bulk installing the upstream humanities-thesis skill",
        "using upstream search.py as a replacement for local literature acquisition, CNKI, Google Scholar, Zotero, or citation-verifier chains",
        "copying long terminology or theorist tables as verified references",
        "treating title, abstract, or metadata-only search results as sufficient paper content evidence",
        "Claude Code or OpenClaw platform instructions as local Codex runtime policy"
      ]
    },
    {
      "upstream": "WantongC/journal-adapt-writing-skill",
      "repo_url": "https://github.com/WantongC/journal-adapt-writing-skill",
      "commit": "cc79265b0acc21bc488c4c3004d89113cf19335a",
      "adopted_as": [
        "target-journal corpus as a dynamic style evidence layer for pre-submission polishing",
        "priority order: manuscript facts and claims, user instructions, target-journal corpus, secondary corpus or exemplars, then static base rules",
        "5-8 readable target-journal papers as the preferred primary style corpus when available",
        "conversion and readability gate before any style extraction",
        "paper style cards and aggregated journal style profile before revision",
        "section-by-section diagnosis, journal-fit score, revision log, and conflict log",
        "temporary dynamic writing skill as a project artifact rather than a global runtime skill"
      ],
      "not_adopted": [
        "installing journal-adapt as a competing top-level runtime skill",
        "using unread, partial, or failed PDF conversions as style evidence",
        "copying, quoting, or paraphrasing target-journal corpus prose into the user manuscript",
        "letting journal style override manuscript facts, evidence, citations, results, equations, variables, or author decisions",
        "treating target-journal style evidence as DOI verification or citation evidence",
        "auto-installing the upstream recommended external static writing skills"
      ]
    }
  ],